{
  "schemaVersion": 1,
  "generatedAt": "2026-09-07",
  "count": 2,
  "updates": [
    {
      "appId": "ytkace",
      "name": "YTKACE",
      "version": "21.36.6",
      "previousVersion": "21.35.3",
      "releaseDate": "2026-09-07",
      "downloadUrl": "https://github.com/mrdrvt99/YouProEXTRA/releases/download/ytkace-ipa1/YTKACE_21.36.6_0.9.2.ipa",
      "changelog": "YouTube 21.36.6 | YTKACE_21.36.6_0.9.2\n\n### Latest Release, ENJOY!!\n#### A new free YouTube enhancer for iOS with downloads, iSponsorBlock, player controls, and interface customization.\n> [!NOTE]\n> - [Altstore source](https://raw.githubusercontent.com/mrdrvt99/Altstore-Repository/main/ytkace.json) is available now!.\n> - **YTUHD** is not included. 4K is available for A16+ devices.\n> - [v0.9.2 release notes](https://github.com/itzzace/ytkace/releases/tag/v0.9.2)\n> - removed gonerino due to bug.\n> - - -\n> #### Extra Tweaks:\n> - `YouPip` `YTABConfig` `YouQuality` `YouChooseQuality`  `YouGetCaption` `YTHoldForSpeed` `YTNativeShare` `YTweaks`\n> -  `Return-YouTube-Dislikes` `DontEatMyContent` `Open in YouTube (Safari Extension)` `VolumeBoostYT` `PleaseDontStopTheMusic`\n\n> [!IMPORTANT]\n> - make sure you reapply tweak by pressing ✔ again after every sideload so background play/pip and cast work. \n\n> [!WARNING]\n> - Extra tweaks that are bundled may be unstable on newer versions.\n\n> [!WARNING]\n> - 21.34.3+ builds require iOS 17+ now.",
      "kind": "updated"
    },
    {
      "appId": "spotiflac",
      "name": "SpotiFLAC Mobile",
      "version": "4.9.6",
      "previousVersion": "4.9.5",
      "releaseDate": "2026-09-07",
      "downloadUrl": "https://github.com/spotiflacapp/SpotiFLAC-Mobile/releases/download/v4.9.6/SpotiFLAC-v4.9.6-ios-unsigned.ipa",
      "changelog": "SpotiFLAC 4.9.6 | SpotiFLAC-v4.9.6-ios-unsigned\n\n### New Features\n\n- **about**: Show compiled short Git commit\n- **metadata**: Add safe batch editing and matching\n- **library**: Add bulk duplicate cleanup\n\n### Bug Fixes\n\n- **metadata**: Preserve track tags across collection screens\n- **replaygain**: Report decoder failures and reject incomplete scans\n- **memory**: Release retired runtimes and idle download heap\n- **download**: Resolve missing album folders before publishing\n- **metadata**: Read quality from Opus in MP4 containers\n- **download**: Remove legacy HIGH quality conversion\n- **download**: Preserve native containers before legacy quality conversion\n- **download**: Publish converted SAF files with the final extension\n- **download**: Size quality picker to its content\n- **download**: Allow dragging the quality picker to dismiss\n- **library**: Retain Opus badges when bitrate is missing\n- **download**: Estimate sizes from track quality metadata\n- **download**: Compare size estimates at each quality tier\n- **replaygain**: Write and verify native Opus gain tags\n- **metadata**: Match recording IDs across inconsistent catalogs\n- **metadata**: Normalize artist credits and preserve recording versions\n- **altstore**: Match source bundle ID to released IPA\n- **download**: Prepare fallback sessions before availability checks\n- **metadata**: Preserve Opus tags during batch re-enrichment\n- Restore SAF metadata fallback and preserve active transfers\n- **download**: Preserve verification provider during fallback\n- Resolve backend and test analyzer diagnostics\n- **download**: Route verification notifications to pending challenges\n- **extensions**: Preserve verification on availability errors\n- **extensions**: Bound stream resolution without timing out active transfers\n- **download**: Preserve audio quality across provider fallback\n- **lyrics**: Align usability checks with shared fixtures\n- **library**: Bound playlist picker SQL parameters\n- **playback**: Retain ReplayGain for SAF descriptor leases\n- **android**: Scope SAF read failures to each descriptor\n- **ios**: Isolate download progress subscriptions\n- **metadata**: Preserve Track fields during enrichment\n- **conversion**: Reserve FLAC outputs without overwriting files\n- **search**: Let latest live queries supersede cancelled requests\n- **auth**: Preserve shared signed-session challenge identity\n- **ui**: Resolve collapsed header title overlap\n- **ui**: Improve adaptive phone and tablet layouts\n- **cover**: Preserve provider high-resolution artwork\n- **extensions**: Shorten verification timeout\n- **audio**: Preserve Opus codec in M4A scans\n- **extensions**: Preserve verification callback retries\n- **conversion**: Preserve Unicode SAF document names\n\n### Performance\n\n- **ui**: Retain platform link lookup across rebuilds\n- **ui**: Retain track history lookup snapshots\n- **metadata**: Read complete SAF tags through descriptors\n- **mp3**: Share bounded ID3 metadata and cover reads\n- **library**: Page missing-file cleanup with safe SAF batch checks\n- **extensions**: Clone only the requested storage value\n- **artwork**: Batch and throttle cached preview validation\n- **library**: Reuse collection lookups across selection rebuilds\n- **search**: Decode large extension results off the UI isolate\n- **library**: Stream normalized scan timestamp snapshots\n- **cache**: Enforce cover byte budget during foreground use\n- **queue**: Apply sparse progress updates with chunked snapshots\n- **images**: Size decoded covers from layout constraints\n\n### Refactoring\n\n- **i18n**: Share supported language choices\n- **batch**: Share local track actions and phase settings\n- **ffmpeg**: Remove unused live DASH subsystem\n\n### Documentation\n\n- **changelog**: Document version 4.9.6\n\n### Styling\n\n- **dart**: Apply pinned formatter to existing files\n\n### Testing\n\n- Decouple app fixtures from extension identities\n\n### Chores\n\n- **release**: Bump app version to 4.9.6\n- **ios**: Reuse backend build script without duplicate framework setup\n- Update AltStore source to v4.9.5 by [@github-actions[bot]](https://github.com/github-actions[bot])\n\n### Build\n\n- **ios**: Require iOS 16 and restore local builds\n\n### Revert\n\n- Remove download size estimates\n\n\n\n\n**Full Changelog**: [v4.9.5...v4.9.6](https://github.com/spotiflacapp/SpotiFLAC-Mobile/compare/v4.9.5...v4.9.6)\n\n---\n\n### Downloads\n\n#### Android\n- **arm64**: `SpotiFLAC-v4.9.6-arm64.apk` (recommended for modern devices)\n- **arm32**: `SpotiFLAC-v4.9.6-arm32.apk` (older devices)\n\n#### iOS\n- **iOS**: `SpotiFLAC-v4.9.6-ios-unsigned.ipa` (sideload required)\n\n### Installation\n**Android**: Enable \"Install from unknown sources\" and install the APK\n**iOS**: Use AltStore, Sideloadly, or similar tools to sideload the IPA",
      "kind": "updated"
    }
  ]
}
