{
  "schemaVersion": 1,
  "generatedAt": "2026-09-07",
  "count": 8,
  "repositories": [
    {
      "id": "github--ashreq-ashstore-repo-861eb454",
      "name": "Ashreq/ashstore-repo",
      "url": "https://github.com/Mark02-2012/YTPlusM",
      "provider": "github",
      "enabled": true,
      "lastSync": "2026-09-07",
      "lastSuccess": "2026-09-07",
      "lastError": null,
      "applicationIds": [
        "maxtube"
      ],
      "retryCount": 0,
      "health": {}
    },
    {
      "id": "github--iamsmmh-omnisource-190e45b6",
      "name": "iamsmmh/OmniSource",
      "url": "https://github.com/arichornlover/uYouEnhanced",
      "provider": "github",
      "enabled": true,
      "lastSync": "2026-09-07",
      "lastSuccess": "2026-09-07",
      "lastError": null,
      "applicationIds": [
        "uyouenhanced"
      ],
      "retryCount": 0,
      "health": {}
    },
    {
      "id": "github--itzzace-ytkace-512d6ce7",
      "name": "itzzace/ytkace",
      "url": "https://github.com/itzzace/ytkace",
      "provider": "github",
      "enabled": true,
      "lastSync": "2026-09-07",
      "lastSuccess": "2026-09-07",
      "lastError": null,
      "applicationIds": [
        "ytkace"
      ],
      "retryCount": 0,
      "health": {}
    },
    {
      "id": "github--mark02-2012-ytmultimateplus-d33fe09c",
      "name": "Mark02-2012/YTMUltimatePLUS",
      "url": "https://github.com/Mark02-2012/YTMUltimatePLUS",
      "provider": "github",
      "enabled": true,
      "lastSync": "2026-09-07",
      "lastSuccess": "2026-09-07",
      "lastError": null,
      "applicationIds": [
        "maxmusic"
      ],
      "retryCount": 0,
      "health": {}
    },
    {
      "id": "github--mrdrvt99-youproextra-532c1a56",
      "name": "mrdrvt99/YouProEXTRA",
      "url": "https://github.com/Dayanch96/YTLite",
      "provider": "github",
      "enabled": true,
      "lastSync": "2026-09-07",
      "lastSuccess": "2026-09-07",
      "lastError": null,
      "applicationIds": [
        "youmod",
        "youpro",
        "ytkp",
        "ytlite"
      ],
      "retryCount": 0,
      "health": {}
    },
    {
      "id": "github--mrdrvt99-ytmusicultimate-b0417fc1",
      "name": "mrdrvt99/YTMusicUltimate",
      "url": "https://github.com/Dayanch96/YTMusicUltimate",
      "provider": "github",
      "enabled": true,
      "lastSync": "2026-09-07",
      "lastSuccess": "2026-09-07",
      "lastError": null,
      "applicationIds": [
        "ytmusic"
      ],
      "retryCount": 0,
      "health": {}
    },
    {
      "id": "github--spotiflacapp-spotiflac-mobile-e255a358",
      "name": "spotiflacapp/SpotiFLAC-Mobile",
      "url": "https://github.com/spotiflacapp/SpotiFLAC-Mobile",
      "provider": "github",
      "enabled": true,
      "lastSync": "2026-09-07",
      "lastSuccess": "2026-09-07",
      "lastError": null,
      "applicationIds": [
        "spotiflac"
      ],
      "retryCount": 0,
      "health": {}
    },
    {
      "id": "github--utmapp-utm-53ff8384",
      "name": "utmapp/UTM",
      "url": "https://github.com/utmapp/UTM",
      "provider": "github",
      "enabled": true,
      "lastSync": "2026-09-07",
      "lastSuccess": "2026-09-07",
      "lastError": null,
      "applicationIds": [
        "utm"
      ],
      "retryCount": 0,
      "health": {}
    }
  ]
}
